title,location,description,details,sub_title
Sales & Enterprise,United States,Enterprise Account Executive - Public Sector,"
Coursera can hire people in any country where we have a legal entity, assuming candidates have eligible working rights and a sufficient timezone overlap with their team. Our interviews and onboarding are conducted virtually, a part of being a remote-first company.
Coursera was launched in 2012 by two Stanford Computer Science professors, Andrew Ng and Daphne Koller, with a mission to provide universal access to world-class learning. It is now one of the largest online learning platforms in the world, with more than 100 million registered learners. Coursera partners with 275+ leading university and industry partners to offer a broad catalog of content and credentials, including courses, Specializations, Professional Certificates, Guided Projects, and bachelor’s and master’s degrees. Institutions around the world use Coursera to upskill and reskill their employees, citizens, and students in fields such as data science, technology, and business. Coursera became a B Corp in February 2021.
Job Overview:

The Enterprise Solutions team serves global organizations, including leading companies, governments, and nonprofits, who seek to upskill or retrain their workforce with the world’s best education. In this role, you will be supporting the Coursera for Government sector of the Enterprise Solutions team. As part of our team, you will play a key role in increasing access to world-class education for government agencies and the people they serve. Specifically, this role will focus on growing our partnerships with Federal Government Agencies. 
Successful candidates will be passionate, entrepreneurial sales professionals who will prospect, develop, and close partnerships with United States federal  government agencies, including  the potential of territory coverage for both civilian and defense sectors. You should have experience with enterprise sales/partnerships in the public sector and be interested in working for a social enterprise with a mission to help people reach their full potential through access to the world’s best education. 

Responsibilities:

Prospect new mid-market Public Sector/Government opportunities in alignment with Coursera’s high-level strategic priorities
Use in-depth knowledge of industry trends and data-driven insights to consult and engage prospective customers 
Develop and execute on sales targets, hitting (and exceeding) revenue/growth goals and sharing learning across the organization.
Balance your efforts effectively between pipeline generation, outbound prospecting, and leading complex sales cycles from start to finish.
Be a voice for Coursera’s public sector partners, sharing customer-driven insights across Coursera, including product, engineering, business development, and legal
Perform various sales and marketing operations tasks, including managing the sales pipeline with Coursera’s CRM tool

Basic Qualifications:

2+ years experience selling solutions within the Federal Civilian and/or Defense sectors.

Preferred Qualifications:

5+ years public sector sales experience at a SaaS company
Superior written and verbal communication skills, strong analytical and creative problem solving abilities, excellent interpersonal skills, organizational, and operational skills
A record of past achievement, including demonstrated ability to close complex, 7-figure deals and the ability to spearhead new strategic initiatives and manage senior-level external stakeholders
Entrepreneurial drive and comfort working in ambiguous, quickly-changing environments
Ability to listen well, hold your own in meetings with senior executive representatives from prospective partners, and speak as a thought-leader in this space
Extensive network in the North American public sector L&D, HR and/or IT space. 
Experience working in the government, military, non-profit, or workforce development spaces a plus

#LI-TP2
Coursera is an Equal Employment Opportunity Employer and considers all qualified applicants without regard to race, color, religion, sex, sexual orientation, gender identity, age, marital status, national origin, protected veteran status, disability, or any other legally protected class.
 
If you are an individual with a disability and require a reasonable accommodation to complete any part of the application process, please contact us at accommodations@coursera.org.
 
For California Candidates, please review our CCPA Applicant Notice here.
For our Global Candidates, please review our GDPR Recruitment Notice here.
 
#LI-Remote
",Sales
